Root Name,Search Term,PMID,Title,Article Type,Publication Year,PubMed URL
Lavender,Lavender,30670268,A randomised controlled trial of Lavender (Lavandula Angustifolia) and Lemon Balm (Melissa Officinalis) essential oils for the treatment of agitated behaviour in older people with and without dementia.,Journal Article; Randomized Controlled Trial,2018,https://pubmed.ncbi.nlm.nih.gov/30670268/
Lavender,Lavender,30660371,Effect of Lavender Oil on the Anxiety of Patients Before Breast Surgery.,Journal Article; Randomized Controlled Trial,2019,https://pubmed.ncbi.nlm.nih.gov/30660371/
Lavender,Lavender,30607990,Evaluation of toxicological and antimicrobial activity of lavender and immortelle essential oils.,Comparative Study; Journal Article,2019,https://pubmed.ncbi.nlm.nih.gov/30607990/
Lavender,Lavender,30439747,Effectiveness of Silexan oral lavender essential oil compared to inhaled lavender essential oil aromatherapy for sleep in adults: a systematic review.,Journal Article; Systematic Review,2018,https://pubmed.ncbi.nlm.nih.gov/30439747/
Lavender,Lavender,30320657,The Effect of Lavender Oil Application via Inhalation Pathway on Hemodialysis Patients' Anxiety Level and Sleep Quality.,Journal Article; Randomized Controlled Trial,2018,https://pubmed.ncbi.nlm.nih.gov/30320657/
Lavender,Lavender,30231567,Treatment Strategies for Infected Wounds.,Journal Article; Review,2018,https://pubmed.ncbi.nlm.nih.gov/30231567/
Lavender,Lavender,30219446,Anthroposophic medicine in the treatment of pediatric pseudocroup: A systematic review.,Journal Article; Systematic Review,2017,https://pubmed.ncbi.nlm.nih.gov/30219446/
Lavender,Lavender,30156654,Effectiveness of aromatherapy massage on the stress of the surgical center nursing team: a pilot study.,Journal Article; Randomized Controlled Trial,2018,https://pubmed.ncbi.nlm.nih.gov/30156654/
Lavender,Lavender,30098868,Monoterpene's multiple free radical scavenging capacity as compared with the radioprotective agent cysteamine and amifostine.,"Comparative Study; Journal Article; Research Support, Non-U.S. Gov't",2018,https://pubmed.ncbi.nlm.nih.gov/30098868/
Lavender,Lavender,30098535,Linalool bioactive properties and potential applicability in drug delivery systems.,Journal Article; Review,2018,https://pubmed.ncbi.nlm.nih.gov/30098535/
Lavender,Lavender,30071118,Antimicrobial activity of essential oils against multidrug-resistant clinical isolates of the Burkholderia cepacia complex.,Comparative Study; Journal Article,2018,https://pubmed.ncbi.nlm.nih.gov/30071118/
Lavender,Lavender,30058555,Role of ibuprofen and lavender oil to alter the stress induced psychological disorders: A comparative study.,Comparative Study; Journal Article,2018,https://pubmed.ncbi.nlm.nih.gov/30058555/
Lavender,Lavender,30056792,Pharmacotherapy for generalized anxiety disorder in adult and pediatric patients: an evidence-based treatment review.,Journal Article; Review,2018,https://pubmed.ncbi.nlm.nih.gov/30056792/
Lavender,Lavender,30045046,Lavender Color in Linked Color Imaging Enables Noninvasive Detection of Gastric Intestinal Metaplasia.,Evaluation Study; Journal Article,2018,https://pubmed.ncbi.nlm.nih.gov/30045046/
Lavender,Lavender,29970430,Major Discrepancies of HCV Viral Loads Determined by Real Time Polymerase Chain Reaction Caused by Use of Collection Tubes that Differ Only with the Presence or Absence of Serum Separator.,Comparative Study; Journal Article,2018,https://pubmed.ncbi.nlm.nih.gov/29970430/
Lavender,Lavender,29787355,Effect of Lavender cream with or without footbath on sleep quality and fatigue in pregnancy and postpartum: a randomized controlled trial.,Journal Article; Randomized Controlled Trial,2018,https://pubmed.ncbi.nlm.nih.gov/29787355/
Lavender,Lavender,29778129,The Effect of Lavender Aromatherapy on the Symptoms of Menopause.,Journal Article; Randomized Controlled Trial,2017,https://pubmed.ncbi.nlm.nih.gov/29778129/
Lavender,Lavender,29705457,Comparing the effects of relaxation technique and inhalation aromatherapy on fatigue in patients undergoing hemodialysis.,Comparative Study; Journal Article; Randomized Controlled Trial,2018,https://pubmed.ncbi.nlm.nih.gov/29705457/
Lavender,Lavender,29705445,"Comparison of the effect of lavender and bitter orange on anxiety in postmenopausal women: A triple-blind, randomized, controlled clinical trial.",Comparative Study; Journal Article; Randomized Controlled Trial,2018,https://pubmed.ncbi.nlm.nih.gov/29705445/
Lavender,Lavender,29565630,Effectiveness of Aromatherapy Massage and Inhalation on Symptoms of Depression in Chinese Community-Dwelling Older Adults.,Journal Article; Randomized Controlled Trial,2018,https://pubmed.ncbi.nlm.nih.gov/29565630/
Lavender,Lavender,29547610,Aromatherapy: The Effect of Lavender on Anxiety and Sleep Quality in Patients Treated With Chemotherapy.,Comparative Study; Journal Article; Randomized Controlled Trial,2018,https://pubmed.ncbi.nlm.nih.gov/29547610/
Lavender,Lavender,29535280,"[Effects of Aromatherapy on Stress Responses, Autonomic Nervous System Activity and Blood Pressure in the Patients Undergoing Coronary Angiography: A Non-Randomized Controlled Trial].",Controlled Clinical Trial; Journal Article,2018,https://pubmed.ncbi.nlm.nih.gov/29535280/
Lavender,Lavender,29508154,Complementary and Alternative Medicine Treatments for Generalized Anxiety Disorder: Systematic Review and Meta-analysis of Randomized Controlled Trials.,Journal Article; Systematic Review,2018,https://pubmed.ncbi.nlm.nih.gov/29508154/
Lavender,Lavender,29464801,Herbal medicine for depression and anxiety: A systematic review with assessment of potential psycho-oncologic relevance.,Journal Article; Systematic Review,2018,https://pubmed.ncbi.nlm.nih.gov/29464801/
Lavender,Lavender,29458940,The effects of preoperative aromatherapy massage on anxiety and sleep quality of colorectal surgery patients: A randomized controlled study.,Journal Article; Randomized Controlled Trial,2017,https://pubmed.ncbi.nlm.nih.gov/29458940/
Lavender,Lavender,29458934,Effect of aromatherapy on coping with premenstrual syndrome: A randomized controlled trial.,Journal Article; Randomized Controlled Trial,2017,https://pubmed.ncbi.nlm.nih.gov/29458934/
Lavender,Lavender,29389470,Aromatherapy massage with lavender essential oil and the prevention of disability in ADL in patients with osteoarthritis of the knee: A randomized controlled clinical trial.,Journal Article; Review,2017,https://pubmed.ncbi.nlm.nih.gov/29389470/
Lavender,Lavender,29239483,The effects of olfactory stimulation on the behavior of captive ring-tailed lemurs (Lemur catta).,Clinical Trial; Journal Article,2017,https://pubmed.ncbi.nlm.nih.gov/29239483/
Lavender,Lavender,29199999,Effect of Inhalation Aromatherapy on Procedural Pain and Anxiety After Needle Insertion Into an Implantable Central Venous Port Catheter: A Quasi-Randomized Controlled Pilot Study.,Journal Article; Randomized Controlled Trial,2019,https://pubmed.ncbi.nlm.nih.gov/29199999/
Lavender,Lavender,29150713,"Efficacy of Silexan in subthreshold anxiety: meta-analysis of randomised, placebo-controlled trials.",Journal Article; Meta-Analysis,2017,https://pubmed.ncbi.nlm.nih.gov/29150713/
Lavender,Lavender,29071755,"Effect of aromatherapy massage on anxiety, depression, and physiologic parameters in older patients with the acute coronary syndrome: A randomized clinical trial.",Journal Article; Randomized Controlled Trial,2017,https://pubmed.ncbi.nlm.nih.gov/29071755/
Lavender,Lavender,28917370,Aromatherapies using Osmanthus fragrans oil and grapefruit oil are effective complementary treatments for anxious patients undergoing colonoscopy: A randomized controlled study.,Journal Article; Randomized Controlled Trial,2017,https://pubmed.ncbi.nlm.nih.gov/28917370/
Lavender,Lavender,28803691,Effectiveness of Lavendula stoechas essential oil in treatment of mild to moderate carpal tunnel syndrome: A randomized controlled trial.,Journal Article; Randomized Controlled Trial,2017,https://pubmed.ncbi.nlm.nih.gov/28803691/
Lavender,Lavender,28783372,"Effects of Aromatherapy Massage on Pregnant Women's Stress and Immune Function: A Longitudinal, Prospective, Randomized Controlled Trial.",Journal Article; Randomized Controlled Trial,2017,https://pubmed.ncbi.nlm.nih.gov/28783372/
Lavender,Lavender,28779939,Effects of lavender scent on patients' anxiety and pain levels during gynecological examination.,Journal Article; Randomized Controlled Trial,2017,https://pubmed.ncbi.nlm.nih.gov/28779939/
Lavender,Lavender,28754054,"Help me, help me.",Case Reports; Journal Article,2017,https://pubmed.ncbi.nlm.nih.gov/28754054/
Lavender,Lavender,28749734,"Comparison of the effect of lavender and bitter orange on sleep quality in postmenopausal women: A triple-blind, randomized, controlled clinical trial.","Comparative Study; Journal Article; Randomized Controlled Trial; Research Support, Non-U.S. Gov't",2017,https://pubmed.ncbi.nlm.nih.gov/28749734/
Lavender,Lavender,28634728,Aroma oil therapy in palliative care: a pilot study with physiological parameters in conscious as well as unconscious patients.,Journal Article; Randomized Controlled Trial,2017,https://pubmed.ncbi.nlm.nih.gov/28634728/
Lavender,Lavender,28605119,Aromatherapy Massage for Neuropathic Pain and Quality of Life in Diabetic Patients.,"Journal Article; Randomized Controlled Trial; Research Support, Non-U.S. Gov't",2017,https://pubmed.ncbi.nlm.nih.gov/28605119/
Lavender,Lavender,28511598,Silexan in anxiety disorders: Clinical data and pharmacological background.,Journal Article; Review,2017,https://pubmed.ncbi.nlm.nih.gov/28511598/
Lavender,Lavender,28504569,Comparisons for Effectiveness of Aromatherapy and Acupressure Massage on Quality of Life in Career Women: A Randomized Controlled Trial.,Journal Article; Randomized Controlled Trial,2017,https://pubmed.ncbi.nlm.nih.gov/28504569/
Lavender,Lavender,28481623,Does Japanese Citrus Fruit Yuzu (Citrus junos Sieb. ex Tanaka) Fragrance Have Lavender-Like Therapeutic Effects That Alleviate Premenstrual Emotional Symptoms? A Single-Blind Randomized Crossover Study.,Journal Article; Randomized Controlled Trial,2017,https://pubmed.ncbi.nlm.nih.gov/28481623/
Lavender,Lavender,28449600,Comparison of phenolic acids and flavonoids contents in various cultivars and parts of common lavender (Lavandula angustifolia) derived from Poland.,Comparative Study; Journal Article,2017,https://pubmed.ncbi.nlm.nih.gov/28449600/
Lavender,Lavender,28395396,A Randomized Controlled Trial Provides Evidence to Support Aromatherapy to Minimize Anxiety in Women Undergoing Breast Biopsy.,Journal Article; Randomized Controlled Trial,2017,https://pubmed.ncbi.nlm.nih.gov/28395396/
Lavender,Lavender,28319423,Silexan does not cause withdrawal symptoms even when abruptly discontinued.,Journal Article; Randomized Controlled Trial,2017,https://pubmed.ncbi.nlm.nih.gov/28319423/
Lavender,Lavender,28236262,Comparing effects between music intervention and aromatherapy on anxiety of patients undergoing mechanical ventilation in the intensive care unit: a randomized controlled trial.,Journal Article; Randomized Controlled Trial,2017,https://pubmed.ncbi.nlm.nih.gov/28236262/
Lavender,Lavender,28169850,American Contact Dermatitis Society Core Allergen Series: 2017 Update.,Journal Article; Review,2017,https://pubmed.ncbi.nlm.nih.gov/28169850/
Lavender,Lavender,28166628,"""More than Honey"": Investigation on Volatiles from Monovarietal Honeys Using New Analytical and Sensory Approaches.",Evaluation Study; Journal Article,2017,https://pubmed.ncbi.nlm.nih.gov/28166628/
Lavender,Lavender,28077825,[Inhalation Effects of Aroma Essential Oil on Quality of Sleep for Shift Nurses after Night Work].,Controlled Clinical Trial; Journal Article,2016,https://pubmed.ncbi.nlm.nih.gov/28077825/
Lavender,Lavender,27863615,The effect of aromatherapy with lavender essence on severity of labor pain and duration of labor in primiparous women.,Journal Article; Randomized Controlled Trial,2016,https://pubmed.ncbi.nlm.nih.gov/27863615/
Lavender,Lavender,27863613,Effect of aromatherapy massage with lavender essential oil on pain in patients with osteoarthritis of the knee: A randomized controlled clinical trial.,Journal Article; Randomized Controlled Trial,2016,https://pubmed.ncbi.nlm.nih.gov/27863613/
Lavender,Lavender,27861196,Lavender Oil Preparation (Silexan) for Treating Anxiety: An Updated Meta-Analysis.,Letter; Meta-Analysis,2017,https://pubmed.ncbi.nlm.nih.gov/27861196/
Lavender,Lavender,27829428,Aromatherapy for the treatment of PONV in children: a pilot RCT.,Journal Article; Randomized Controlled Trial,2016,https://pubmed.ncbi.nlm.nih.gov/27829428/
Lavender,Lavender,27775966,"Essential Oils, Part V: Peppermint Oil, Lavender Oil, and Lemongrass Oil.",Journal Article; Review,2016,https://pubmed.ncbi.nlm.nih.gov/27775966/
Lavender,Lavender,27698173,Pseudomonas aeruginosa mastitis in two goats associated with an essential oil-based teat dip.,Case Reports; Journal Article,2016,https://pubmed.ncbi.nlm.nih.gov/27698173/
Lavender,Lavender,27575673,Comparing the effects of aromatherapy massage and inhalation aromatherapy on anxiety and pain in burn patients: A single-blind randomized clinical trial.,Comparative Study; Journal Article; Randomized Controlled Trial,2016,https://pubmed.ncbi.nlm.nih.gov/27575673/
Lavender,Lavender,27555173,Both lavender fleur oil and unscented oil aromatherapy reduce preoperative anxiety in breast surgery patients: a randomized trial.,Comparative Study; Journal Article; Randomized Controlled Trial,2016,https://pubmed.ncbi.nlm.nih.gov/27555173/
Lavender,Lavender,27427817,"Essential Oils, Part III: Chemical Composition.",Journal Article; Review,2016,https://pubmed.ncbi.nlm.nih.gov/27427817/
Lavender,Lavender,27388435,Effect of lavender aromatherapy on menopause hot flushing: A crossover randomized clinical trial.,Journal Article; Randomized Controlled Trial,2016,https://pubmed.ncbi.nlm.nih.gov/27388435/
Lavender,Lavender,27355279,Aroma Effects on Physiologic and Cognitive Function Following Acute Stress: A Mechanism Investigation.,Journal Article; Randomized Controlled Trial,2016,https://pubmed.ncbi.nlm.nih.gov/27355279/
Lavender,Lavender,27159213,Aromatherapy for the Treatment of Patients with Behavioral and Psychological Symptoms of Dementia: A Descriptive Analysis of RCTs.,Journal Article; Review,2016,https://pubmed.ncbi.nlm.nih.gov/27159213/
Lavender,Lavender,27157961,"Evaluating the efficacy of lavender aromatherapy on peripheral venous cannulation pain and anxiety: A prospective, randomized study.",Journal Article; Randomized Controlled Trial,2016,https://pubmed.ncbi.nlm.nih.gov/27157961/
Lavender,Lavender,27086012,Data fusion between high resolution (1)H-NMR and mass spectrometry: a synergetic approach to honey botanical origin characterization.,Evaluation Study; Journal Article,2016,https://pubmed.ncbi.nlm.nih.gov/27086012/
Lavender,Lavender,26850806,The use of aromasticks to help with sleep problems: A patient experience survey.,Journal Article; Randomized Controlled Trial,2015,https://pubmed.ncbi.nlm.nih.gov/26850806/
Lavender,Lavender,26850803,The effects of aromatherapy with lavender essential oil on fatigue levels in haemodialysis patients: A randomized clinical trial.,Journal Article; Randomized Controlled Trial,2015,https://pubmed.ncbi.nlm.nih.gov/26850803/
Lavender,Lavender,26831038,Harvest date effects on aroma compounds in aged Riesling icewines.,Comparative Study; Journal Article,2016,https://pubmed.ncbi.nlm.nih.gov/26831038/
Lavender,Lavender,26718792,"Efficacy of Silexan in mixed anxiety-depression--A randomized, placebo-controlled trial.","Journal Article; Randomized Controlled Trial; Research Support, Non-U.S. Gov't",2015,https://pubmed.ncbi.nlm.nih.gov/26718792/
Lavender,Lavender,26646574,A Case of Psoriasis Replaced by Allergic Contact Dermatitis in a 12-Year-Old Boy.,Case Reports; Journal Article,2015,https://pubmed.ncbi.nlm.nih.gov/26646574/
Lavender,Lavender,26630428,Herbal Medicine for Low Back Pain: A Cochrane Review.,Journal Article; Systematic Review,2016,https://pubmed.ncbi.nlm.nih.gov/26630428/
Lavender,Lavender,26539382,"Essential oils, their therapeutic properties, and implication in dentistry: A review.",Journal Article; Review,2015,https://pubmed.ncbi.nlm.nih.gov/26539382/
Lavender,Lavender,26497887,Melatonin as an Antioxidant for Stroke Neuroprotection.,"Journal Article; Research Support, N.I.H., Extramural; Research Support, Non-U.S. Gov't; Review",2015,https://pubmed.ncbi.nlm.nih.gov/26497887/
Lavender,Lavender,26473822,A Systematic Review of the Anxiolytic-Like Effects of Essential Oils in Animal Models.,"Journal Article; Research Support, Non-U.S. Gov't; Systematic Review",2015,https://pubmed.ncbi.nlm.nih.gov/26473822/
Lavender,Lavender,26353172,Prepubertal gynecomastia and chronic lavender exposure: report of three cases.,Case Reports; Journal Article,2016,https://pubmed.ncbi.nlm.nih.gov/26353172/
Lavender,Lavender,26293583,"Efficacy of orally administered Silexan in patients with anxiety-related restlessness and disturbed sleep--A randomized, placebo-controlled trial.","Journal Article; Randomized Controlled Trial; Research Support, Non-U.S. Gov't",2015,https://pubmed.ncbi.nlm.nih.gov/26293583/
Lavender,Lavender,26272447,Comparison of the Effect of Massage Therapy and Isometric Exercises on Primary Dysmenorrhea: A Randomized Controlled Clinical Trial.,Comparative Study; Journal Article; Randomized Controlled Trial,2015,https://pubmed.ncbi.nlm.nih.gov/26272447/
Lavender,Lavender,26222759,The Effect of Lavender Oil in Patients with Renal Colic: A Prospective Controlled Study Using Objective and Subjective Outcome Measurements.,Controlled Clinical Trial; Journal Article,2015,https://pubmed.ncbi.nlm.nih.gov/26222759/
Lavender,Lavender,26211735,Effects of aromatherapy on sleep quality and anxiety of patients.,Journal Article; Randomized Controlled Trial,2015,https://pubmed.ncbi.nlm.nih.gov/26211735/
Lavender,Lavender,26175929,Preclinical development and clinical use of perillyl alcohol for chemoprevention and cancer therapy.,Journal Article; Review,2015,https://pubmed.ncbi.nlm.nih.gov/26175929/
Lavender,Lavender,26133206,Effect of Inhaled Lavender and Sleep Hygiene on Self-Reported Sleep Issues: A Randomized Controlled Trial.,"Journal Article; Randomized Controlled Trial; Research Support, Non-U.S. Gov't",2015,https://pubmed.ncbi.nlm.nih.gov/26133206/
Lavender,Lavender,26051567,Effect of inhalation aromatherapy with lavender essential oil on stress and vital signs in patients undergoing coronary artery bypass surgery: A single-blinded randomized clinical trial.,"Journal Article; Randomized Controlled Trial; Research Support, Non-U.S. Gov't",2014,https://pubmed.ncbi.nlm.nih.gov/26051567/
Lavender,Lavender,26051566,The effect of topical application of lavender essential oil on the intensity of pain caused by the insertion of dialysis needles in hemodialysis patients: A randomized clinical trial.,Journal Article; Randomized Controlled Trial,2015,https://pubmed.ncbi.nlm.nih.gov/26051566/
Lavender,Lavender,25893282,Plant essential oils and allied volatile fractions as multifunctional additives in meat and fish-based food products: a review.,Journal Article; Review,2015,https://pubmed.ncbi.nlm.nih.gov/25893282/
Lavender,Lavender,25761625,Essential oils and distilled straws of lavender and lavandin: a review of current use and potential application in white biotechnology.,"Journal Article; Research Support, Non-U.S. Gov't; Review",2015,https://pubmed.ncbi.nlm.nih.gov/25761625/
Lavender,Lavender,25677490,Premature thelarche in the setting of high lavender oil exposure.,Case Reports; Letter,2015,https://pubmed.ncbi.nlm.nih.gov/25677490/
Lavender,Lavender,25673580,Broken Heart Syndrome: A Typical Case.,Case Reports; Journal Article,2015,https://pubmed.ncbi.nlm.nih.gov/25673580/
Lavender,Lavender,25536022,Herbal medicine for low-back pain.,"Journal Article; Meta-Analysis; Research Support, N.I.H., Extramural; Research Support, Non-U.S. Gov't; Systematic Review",2014,https://pubmed.ncbi.nlm.nih.gov/25536022/
Lavender,Lavender,25522403,"Effects of Silexan on the serotonin-1A receptor and microstructure of the human brain: a randomized, placebo-controlled, double-blind, cross-over study with molecular and structural neuroimaging.","Journal Article; Randomized Controlled Trial; Research Support, Non-U.S. Gov't",2014,https://pubmed.ncbi.nlm.nih.gov/25522403/
Lavender,Lavender,25384116,Lavender-thymol as a new topical aromatherapy preparation for episiotomy: A randomised clinical trial.,Journal Article; Randomized Controlled Trial; Retracted Publication,2015,https://pubmed.ncbi.nlm.nih.gov/25384116/
Lavender,Lavender,25358104,High-resolution mass spectrometry associated with data mining tools for the detection of pollutants and chemical characterization of honey samples.,"Evaluation Study; Journal Article; Research Support, Non-U.S. Gov't",2014,https://pubmed.ncbi.nlm.nih.gov/25358104/
Lavender,Lavender,25319228,No interacting influence of lavender oil preparation silexan on oral contraception using an ethinyl estradiol/levonorgestrel combination.,"Journal Article; Randomized Controlled Trial; Research Support, Non-U.S. Gov't",2014,https://pubmed.ncbi.nlm.nih.gov/25319228/
Lavender,Lavender,25192562,The effectiveness of essential oils for patients with neck pain: a randomized controlled study.,"Journal Article; Randomized Controlled Trial; Research Support, Non-U.S. Gov't",2014,https://pubmed.ncbi.nlm.nih.gov/25192562/
Lavender,Lavender,25183507,Role of expectations and pleasantness of essential oils in their acute effects.,"Comparative Study; Journal Article; Randomized Controlled Trial; Research Support, Non-U.S. Gov't",2014,https://pubmed.ncbi.nlm.nih.gov/25183507/
Lavender,Lavender,25070746,Attentional control in the attentional blink is modulated by odor.,Comparative Study; Controlled Clinical Trial; Journal Article,2014,https://pubmed.ncbi.nlm.nih.gov/25070746/
Lavender,Lavender,25027164,Color-detection thresholds in rhesus macaque monkeys and humans.,"Comparative Study; Journal Article; Research Support, N.I.H., Extramural; Research Support, Non-U.S. Gov't; Research Support, U.S. Gov't, Non-P.H.S.",2014,https://pubmed.ncbi.nlm.nih.gov/25027164/
Lavender,Lavender,25002406,Olfactory stimulatory with grapefruit and lavender oils change autonomic nerve activity and physiological function.,Journal Article; Review,2014,https://pubmed.ncbi.nlm.nih.gov/25002406/
Lavender,Lavender,24946435,[Herbal remedies in depression--state of the art].,English Abstract; Journal Article; Review,2014,https://pubmed.ncbi.nlm.nih.gov/24946435/
Lavender,Lavender,24782235,The influence of ambient scent and music on patients' anxiety in a waiting room of a plastic surgeon.,Journal Article; Randomized Controlled Trial,2014,https://pubmed.ncbi.nlm.nih.gov/24782235/
Lavender,Lavender,24731891,Effect of lavender inhalation on the symptoms of primary dysmenorrhea and the amount of menstrual bleeding: A randomized clinical trial.,Journal Article; Randomized Controlled Trial,2014,https://pubmed.ncbi.nlm.nih.gov/24731891/
Lavender,Lavender,24720812,A systematic review of the effect of inhaled essential oils on sleep.,Journal Article; Systematic Review,2014,https://pubmed.ncbi.nlm.nih.gov/24720812/
Lavender,Lavender,24707312,Essential oils for complementary treatment of surgical patients: state of the art.,Journal Article; Review,2014,https://pubmed.ncbi.nlm.nih.gov/24707312/
Lavender,Lavender,24571090,Comparative studies of cytotoxic and apoptotic properties of different extracts and the essential oil of Lavandula angustifolia on malignant and normal cells.,"Comparative Study; Journal Article; Research Support, Non-U.S. Gov't",2014,https://pubmed.ncbi.nlm.nih.gov/24571090/
Lavender,Lavender,24569873,Aromatherapy for dementia.,"Journal Article; Meta-Analysis; Research Support, Non-U.S. Gov't; Systematic Review",2014,https://pubmed.ncbi.nlm.nih.gov/24569873/
Lavender,Lavender,24559818,"A case series on the use of lavendula oil capsules in patients suffering from major depressive disorder and symptoms of psychomotor agitation, insomnia and anxiety.",Case Reports; Journal Article,2013,https://pubmed.ncbi.nlm.nih.gov/24559818/
Lavender,Lavender,24456909,"Lavender oil preparation Silexan is effective in generalized anxiety disorder--a randomized, double-blind comparison to placebo and paroxetine.","Comparative Study; Journal Article; Multicenter Study; Randomized Controlled Trial; Research Support, Non-U.S. Gov't",2014,https://pubmed.ncbi.nlm.nih.gov/24456909/
Lavender,Lavender,24439636,The effects of lavender aromatherapy on pain following needle insertion into a fistula in hemodialysis patients.,"Journal Article; Randomized Controlled Trial; Research Support, Non-U.S. Gov't",2013,https://pubmed.ncbi.nlm.nih.gov/24439636/
Lavender,Lavender,24382614,Effect of lavender aromatherapy on vital signs and perceived quality of sleep in the intermediate care unit: a pilot study.,"Journal Article; Randomized Controlled Trial; Research Support, Non-U.S. Gov't",2014,https://pubmed.ncbi.nlm.nih.gov/24382614/
Lavender,Lavender,24326741,"Multinational, double-blind, randomised, placebo-controlled, prospective study of esomeprazole in the prevention of recurrent peptic ulcer in low-dose acetylsalicylic acid users: the LAVENDER study.","Journal Article; Multicenter Study; Randomized Controlled Trial; Research Support, Non-U.S. Gov't",2013,https://pubmed.ncbi.nlm.nih.gov/24326741/
Lavender,Lavender,24219098,"A randomized, controlled cross-over trial of dermally-applied lavender (Lavandula angustifolia) oil as a treatment of agitated behaviour in dementia.","Journal Article; Randomized Controlled Trial; Research Support, Non-U.S. Gov't",2013,https://pubmed.ncbi.nlm.nih.gov/24219098/
