Root Name,Search Term,PMID,Title,Article Type,Publication Year,PubMed URL
Bergamot,Bergamot,16219446,Assessment of the phototoxic hazard of some essential oils using modified 3T3 neutral red uptake assay.,Comparative Study; Journal Article,2005,https://pubmed.ncbi.nlm.nih.gov/16219446/
Bergamot,Bergamot,12805340,Inhalation aromatherapy during radiotherapy: results of a placebo-controlled double-blind randomized trial.,Clinical Trial; Journal Article; Randomized Controlled Trial,2003,https://pubmed.ncbi.nlm.nih.gov/12805340/
Bergamot,Bergamot,12413335,Berloque dermatitis mimicking child abuse.,Case Reports; Journal Article,2002,https://pubmed.ncbi.nlm.nih.gov/12413335/
Bergamot,Bergamot,12184670,"Berloque dermatitis induced by ""Florida water"".",Case Reports; Journal Article,2002,https://pubmed.ncbi.nlm.nih.gov/12184670/
Bergamot,Bergamot,11511848,Accidental bullous phototoxic reactions to bergamot aromatherapy oil.,Case Reports; Journal Article,2001,https://pubmed.ncbi.nlm.nih.gov/11511848/
Bergamot,Bergamot,11183431,A randomized trial of aromatherapy to reduce anxiety before abortion.,Clinical Trial; Journal Article; Randomized Controlled Trial,2000,https://pubmed.ncbi.nlm.nih.gov/11183431/
Bergamot,Bergamot,8027588,Quantitative assessment of epidermal melanogenesis in C3H/Tif hr/hr mice treated with topical furocoumarins and UVA radiation.,"Comparative Study; Journal Article; Research Support, Non-U.S. Gov't",1994,https://pubmed.ncbi.nlm.nih.gov/8027588/
Bergamot,Bergamot,2027902,Photoreactivity of 5-geranoxypsoralen and lack of photoreaction with DNA.,Comparative Study; Journal Article,1991,https://pubmed.ncbi.nlm.nih.gov/2027902/
Bergamot,Bergamot,6401124,A quantitative in vitro assay for the evaluation of phototoxic potential of topically applied materials.,Comparative Study; Journal Article,1984,https://pubmed.ncbi.nlm.nih.gov/6401124/
Bergamot,Bergamot,6236066,[Contact dermatitis caused by bergamot oil].,"Case Reports; English Abstract; Journal Article; Research Support, Non-U.S. Gov't",1984,https://pubmed.ncbi.nlm.nih.gov/6236066/
Bergamot,Bergamot,428611,[Phototoxicity of Bergamot oil. Comparison between humans and guinea pigs].,Comparative Study; English Abstract; Journal Article,1979,https://pubmed.ncbi.nlm.nih.gov/428611/
Bergamot,Bergamot,778294,"Cutaneous photobiology: past, present and future.","Historical Article; Journal Article; Research Support, U.S. Gov't, P.H.S.; Review",1976,https://pubmed.ncbi.nlm.nih.gov/778294/
Sandalwood,Sandalwood,40724238,Chemical Profiling and Quality Assessment of Food Products Employing Magnetic Resonance Technologies.,Journal Article; Review,2025,https://pubmed.ncbi.nlm.nih.gov/40724238/
Sandalwood,Sandalwood,39942962,Aromatherapy and Essential Oils: Holistic Strategies in Complementary and Alternative Medicine for Integral Wellbeing.,Journal Article; Review,2025,https://pubmed.ncbi.nlm.nih.gov/39942962/
Sandalwood,Sandalwood,39199359,Biological Properties of Sandalwood Oil and Microbial Synthesis of Its Major Sesquiterpenoids.,Journal Article; Review,2024,https://pubmed.ncbi.nlm.nih.gov/39199359/
Sandalwood,Sandalwood,38567353,Traditional Tibetan medicine: therapeutic potential in lung diseases.,Journal Article; Review,2024,https://pubmed.ncbi.nlm.nih.gov/38567353/
Sandalwood,Sandalwood,38481824,"Draft genome sequence of '<i>Candidatus</i> Phytoplasma asteris,' strain SW86 associated with sandal spike disease (SSD).",Case Reports; Journal Article,2024,https://pubmed.ncbi.nlm.nih.gov/38481824/
Sandalwood,Sandalwood,38300372,"Effects of extended dietary supplementation with Santalum album essential oil on hemato-biochemical changes, innate immune response, antioxidant status, and expression of related gene in Nile tilapia (Oreochromis niloticus).","Journal Article; Randomized Controlled Trial, Veterinary",2024,https://pubmed.ncbi.nlm.nih.gov/38300372/
Sandalwood,Sandalwood,36716213,Botanical Ingredient Forensics: Detection of Attempts to Deceive Commonly Used Analytical Methods for Authenticating Herbal Dietary and Food Ingredients and Supplements.,Journal Article; Review,2023,https://pubmed.ncbi.nlm.nih.gov/36716213/
Sandalwood,Sandalwood,36069757,"<i>Santalum</i> Genus: phytochemical constituents, biological activities and health promoting-effects.",Journal Article; Review,2022,https://pubmed.ncbi.nlm.nih.gov/36069757/
Sandalwood,Sandalwood,35620220,Anaesthesia of decapod crustaceans.,Journal Article; Review,2022,https://pubmed.ncbi.nlm.nih.gov/35620220/
Sandalwood,Sandalwood,35482775,Comparative transcriptome profiling of high and low oil yielding Santalum album L.,Comparative Study; Journal Article,2022,https://pubmed.ncbi.nlm.nih.gov/35482775/
Sandalwood,Sandalwood,34704695,Understanding COVID-19 in the light of epidemic disease described in Unani medicine.,Journal Article; Review,2020,https://pubmed.ncbi.nlm.nih.gov/34704695/
Sandalwood,Sandalwood,34579313,"Knowledge Gaps in Taxonomy, Ecology, Population Distribution Drivers and Genetic Diversity of African Sandalwood (<i>Osyris lanceolata</i> Hochst. & Steud.): A Scoping Review for Conservation.",Journal Article; Scoping Review,2021,https://pubmed.ncbi.nlm.nih.gov/34579313/
Sandalwood,Sandalwood,33801098,Pterostilbene in Cancer Therapy.,Journal Article; Review,2021,https://pubmed.ncbi.nlm.nih.gov/33801098/
Sandalwood,Sandalwood,33544515,Understanding <i>Humma-e-Wabai</i> (epidemic fever) and <i>Amraz-e-Wabai</i> (epidemic disease) in the light of Unani medicine.,Journal Article; Review,2021,https://pubmed.ncbi.nlm.nih.gov/33544515/
Sandalwood,Sandalwood,36117763,Advances in biotechnological production of santalenes and santalols.,Journal Article; Review,2020,https://pubmed.ncbi.nlm.nih.gov/36117763/
Sandalwood,Sandalwood,32966232,Understanding COVID-19 in the light of epidemic disease described in Unani medicine.,Journal Article; Review,2020,https://pubmed.ncbi.nlm.nih.gov/32966232/
Sandalwood,Sandalwood,32761779,Home remedies in different pediatric dermatoses: An observational study.,Journal Article; Observational Study,2020,https://pubmed.ncbi.nlm.nih.gov/32761779/
Sandalwood,Sandalwood,32645251,"Topical odorant application of the specific olfactory receptor OR2AT4 agonist, Sandalore<sup>®</sup> , improves telogen effluvium-associated parameters.",Journal Article; Randomized Controlled Trial,2020,https://pubmed.ncbi.nlm.nih.gov/32645251/
Sandalwood,Sandalwood,32020196,Screening for Enhancement of Permethrin Toxicity by Plant Essential Oils Against Adult Females of the Yellow Fever Mosquito (Diptera: Culicidae).,"Comparative Study; Evaluation Study; Journal Article; Research Support, U.S. Gov't, P.H.S.",2020,https://pubmed.ncbi.nlm.nih.gov/32020196/
Sandalwood,Sandalwood,31864359,Effectiveness of plant-based repellents against different Anopheles species: a systematic review.,Journal Article; Systematic Review,2019,https://pubmed.ncbi.nlm.nih.gov/31864359/
Sandalwood,Sandalwood,31728173,Synthetic terpenoids in the world of fragrances: Iso E Super<sup>®</sup> is the showcase.,Journal Article; Review,2019,https://pubmed.ncbi.nlm.nih.gov/31728173/
Sandalwood,Sandalwood,31506756,[Most important contact allergens in hand eczema].,Journal Article; Review,2019,https://pubmed.ncbi.nlm.nih.gov/31506756/
Sandalwood,Sandalwood,30504917,Selection and Validation of Novel RT-qPCR Reference Genes under Hormonal Stimuli and in Different Tissues of Santalum album.,"Journal Article; Research Support, Non-U.S. Gov't; Validation Study",2018,https://pubmed.ncbi.nlm.nih.gov/30504917/
Sandalwood,Sandalwood,30511123,Alternative Treatments for Atopic Dermatitis: An Update.,Journal Article; Review,2019,https://pubmed.ncbi.nlm.nih.gov/30511123/
Sandalwood,Sandalwood,29943532,[Progress in biosynthesis of santalene and santalol].,Journal Article; Review,2018,https://pubmed.ncbi.nlm.nih.gov/29943532/
Sandalwood,Sandalwood,29344319,Sandalwood Album Oil as a Botanical Therapeutic in Dermatology.,Journal Article; Review,2017,https://pubmed.ncbi.nlm.nih.gov/29344319/
Sandalwood,Sandalwood,29130352,"Medicinal properties of alpha-santalol, a naturally occurring constituent of sandalwood oil: review.",Journal Article; Review,2017,https://pubmed.ncbi.nlm.nih.gov/29130352/
Sandalwood,Sandalwood,28633414,An extended model of heartwood secondary metabolism informed by functional genomics.,"Journal Article; Research Support, Non-U.S. Gov't; Review",2018,https://pubmed.ncbi.nlm.nih.gov/28633414/
Sandalwood,Sandalwood,28395396,A Randomized Controlled Trial Provides Evidence to Support Aromatherapy to Minimize Anxiety in Women Undergoing Breast Biopsy.,Journal Article; Randomized Controlled Trial,2017,https://pubmed.ncbi.nlm.nih.gov/28395396/
Sandalwood,Sandalwood,27475678,Promising therapeutic potential of pterostilbene and its mechanistic insight based on preclinical evidence.,Journal Article; Review,2016,https://pubmed.ncbi.nlm.nih.gov/27475678/
Sandalwood,Sandalwood,27427818,"Essential Oils, Part IV: Contact Allergy.",Journal Article; Review,2016,https://pubmed.ncbi.nlm.nih.gov/27427818/
Sandalwood,Sandalwood,27416804,Evaluation of Ubtan - A traditional indian skin care formulation.,Comparative Study; Evaluation Study; Journal Article,2016,https://pubmed.ncbi.nlm.nih.gov/27416804/
Sandalwood,Sandalwood,26850806,The use of aromasticks to help with sleep problems: A patient experience survey.,Journal Article; Randomized Controlled Trial,2015,https://pubmed.ncbi.nlm.nih.gov/26850806/
Sandalwood,Sandalwood,26745967,"Sandalwood: basic biology, tissue culture, and genetic transformation.","Journal Article; Research Support, Non-U.S. Gov't; Review",2016,https://pubmed.ncbi.nlm.nih.gov/26745967/
Sandalwood,Sandalwood,26026073,Anticancer Effects of Sandalwood (Santalum album).,Journal Article; Review,2015,https://pubmed.ncbi.nlm.nih.gov/26026073/
Sandalwood,Sandalwood,25918813,Hawaiian sandalwood: oil composition of Santalum paniculatum and comparison with other sandal species.,Evaluation Study; Journal Article,2014,https://pubmed.ncbi.nlm.nih.gov/25918813/
Sandalwood,Sandalwood,23377508,"Single-center, open-label study of a proprietary topical 0.5% salicylic acid-based treatment regimen containing sandalwood oil in adolescents and adults with mild to moderate acne.","Clinical Trial; Journal Article; Research Support, Non-U.S. Gov't",2012,https://pubmed.ncbi.nlm.nih.gov/23377508/
Sandalwood,Sandalwood,23275078,Comparative effects of sandalwood seed oil on fatty acid profiles and inflammatory factors in rats.,Comparative Study; Journal Article,2012,https://pubmed.ncbi.nlm.nih.gov/23275078/
Sandalwood,Sandalwood,22129314,Antihyperglycemic and antihyperlipidemic effect of Santalum album in streptozotocin induced diabetic rats.,Comparative Study; Journal Article,2011,https://pubmed.ncbi.nlm.nih.gov/22129314/
Sandalwood,Sandalwood,20946456,Contact allergy to essential oils: current patch test results (2000-2008) from the Information Network of Departments of Dermatology (IVDK).,Journal Article; Multicenter Study,2010,https://pubmed.ncbi.nlm.nih.gov/20946456/
Sandalwood,Sandalwood,19831048,Essential oils and anxiolytic aromatherapy.,Journal Article; Review,2009,https://pubmed.ncbi.nlm.nih.gov/19831048/
Sandalwood,Sandalwood,18925629,Evaluation of different internal-diameter column combinations in comprehensive two-dimensional gas chromatography in flavour and fragrance analysis.,Evaluation Study; Journal Article,2008,https://pubmed.ncbi.nlm.nih.gov/18925629/
Sandalwood,Sandalwood,17980948,Safety assessment of sandalwood oil (Santalum album L.).,"Journal Article; Research Support, Non-U.S. Gov't; Review",2007,https://pubmed.ncbi.nlm.nih.gov/17980948/
Sandalwood,Sandalwood,17638336,Comparative molecular and phytochemical study of the tree species Santalum austrocaledonicum (Santalaceae) distributed in the New-Caledonian archipelago.,"Comparative Study; Journal Article; Research Support, Non-U.S. Gov't",2007,https://pubmed.ncbi.nlm.nih.gov/17638336/
Sandalwood,Sandalwood,17101021,Bindi dermatitis to 'chandan' bindi.,Case Reports; Journal Article,2006,https://pubmed.ncbi.nlm.nih.gov/17101021/
Sandalwood,Sandalwood,16648093,Evaluating the effectiveness of aromatherapy in reducing levels of anxiety in palliative care patients: results of a pilot study.,Comparative Study; Journal Article; Multicenter Study; Randomized Controlled Trial,2006,https://pubmed.ncbi.nlm.nih.gov/16648093/
Sandalwood,Sandalwood,16646344,"Field evaluation of New Mountain Sandalwood Mosquito Sticks and New Mountain Sandalwood Botanical Repellent against mosquitoes in North Queensland, Australia.","Evaluation Study; Journal Article; Research Support, Non-U.S. Gov't",2006,https://pubmed.ncbi.nlm.nih.gov/16646344/
Sandalwood,Sandalwood,16364118,Fragrance contact dermatitis in Korea: a joint study.,Journal Article; Multicenter Study,2005,https://pubmed.ncbi.nlm.nih.gov/16364118/
Sandalwood,Sandalwood,15269120,Olfactory receptor neuron profiling using sandalwood odorants.,Comparative Study; Journal Article,2004,https://pubmed.ncbi.nlm.nih.gov/15269120/
Sandalwood,Sandalwood,15224773,Evaluation of agriculture-based phytoremediation in Pacific island ecosystems using trisector planters.,"Evaluation Study; Journal Article; Research Support, U.S. Gov't, Non-P.H.S.",2004,https://pubmed.ncbi.nlm.nih.gov/15224773/
Sandalwood,Sandalwood,14765284,Evaluation of the effects of East Indian sandalwood oil and alpha-santalol on humans after transdermal absorption.,Clinical Trial; Journal Article; Randomized Controlled Trial,2004,https://pubmed.ncbi.nlm.nih.gov/14765284/
Sandalwood,Sandalwood,12898025,Regional genetic differentiation in Western Australian sandalwood (Santalum spicatum) as revealed by nuclear RFLP analysis.,"Comparative Study; Journal Article; Research Support, Non-U.S. Gov't",2003,https://pubmed.ncbi.nlm.nih.gov/12898025/
Sandalwood,Sandalwood,12582025,Chemopreventive effects of alpha-santalol on skin tumor development in CD-1 and SENCAR mice.,"Comparative Study; Journal Article; Research Support, Non-U.S. Gov't; Research Support, U.S. Gov't, P.H.S.",2003,https://pubmed.ncbi.nlm.nih.gov/12582025/
Sandalwood,Sandalwood,12534532,Further important sensitizers in patients sensitive to fragrances.,"Evaluation Study; Journal Article; Multicenter Study; Research Support, Non-U.S. Gov't",2002,https://pubmed.ncbi.nlm.nih.gov/12534532/
Sandalwood,Sandalwood,12162118,[Repellent activity against Aedes aegypti (L.) of formulas based on natural vegetable extracts or synthetic active agents].,Comparative Study; Evaluation Study; Journal Article,2002,https://pubmed.ncbi.nlm.nih.gov/12162118/
Sandalwood,Sandalwood,11190217,Sandalwood: the royal tree.,Journal Article; Review,2000,https://pubmed.ncbi.nlm.nih.gov/11190217/
Sandalwood,Sandalwood,10548401,Sandalwood oil prevent skin tumour development in CD1 mice.,Comparative Study; Journal Article,1999,https://pubmed.ncbi.nlm.nih.gov/10548401/
Sandalwood,Sandalwood,9881362,Structure-odour relationships: results of an applied electron-topological approach.,Journal Article; Review,1998,https://pubmed.ncbi.nlm.nih.gov/9881362/
Sandalwood,Sandalwood,9370104,Chemopreventive effects of sandalwood oil on skin papillomas in mice.,Comparative Study; Journal Article,1997,https://pubmed.ncbi.nlm.nih.gov/9370104/
Sandalwood,Sandalwood,8796746,Fragrance contact dermatitis: a worldwide multicenter investigation (Part I).,"Journal Article; Multicenter Study; Research Support, Non-U.S. Gov't",1996,https://pubmed.ncbi.nlm.nih.gov/8796746/
Sandalwood,Sandalwood,8789238,Allergic contact dermatitis from red sandalwood (Pterocarpus santalinus).,Case Reports; Journal Article,1996,https://pubmed.ncbi.nlm.nih.gov/8789238/
Sandalwood,Sandalwood,8135507,Chemical senses.,Journal Article; Review,1994,https://pubmed.ncbi.nlm.nih.gov/8135507/
Sandalwood,Sandalwood,1291627,Surface comparisons of some odour molecules: conformational calculations on sandalwood odour V.,"Comparative Study; Journal Article; Research Support, Non-U.S. Gov't",1992,https://pubmed.ncbi.nlm.nih.gov/1291627/
Sandalwood,Sandalwood,2069702,[Comparative GC analysis of essential oil in imported sandalwood].,Comparative Study; English Abstract; Journal Article,1991,https://pubmed.ncbi.nlm.nih.gov/2069702/
Sandalwood,Sandalwood,3443530,Sandalwood dermatitis.,Case Reports; Journal Article,1987,https://pubmed.ncbi.nlm.nih.gov/3443530/
Sandalwood,Sandalwood,3621927,Depigmented contact dermatitis due to incense.,"Case Reports; Journal Article; Research Support, Non-U.S. Gov't",1987,https://pubmed.ncbi.nlm.nih.gov/3621927/
Sandalwood,Sandalwood,28150651,Contact dennatitisdue to sandalwood (santalum album linn).,Case Reports; Journal Article,1986,https://pubmed.ncbi.nlm.nih.gov/28150651/
Sandalwood,Sandalwood,6028683,Photoallergy to sandalwood oil.,Case Reports; Journal Article,1967,https://pubmed.ncbi.nlm.nih.gov/6028683/
Ylang Ylang,Ylang Ylang,39186163,"Impact of aromatherapy on anxiety among ICU nurses: A randomized, blinded, placebo-controlled trial.",Journal Article; Randomized Controlled Trial,2024,https://pubmed.ncbi.nlm.nih.gov/39186163/
Ylang Ylang,Ylang Ylang,38087747,Effect of Lavandula angustifolia and Cananga odorata on decrease of blood pressure in high blood pressure volunteers: A randomized controlled trial.,Journal Article; Randomized Controlled Trial,2023,https://pubmed.ncbi.nlm.nih.gov/38087747/
Ylang Ylang,Ylang Ylang,37054616,The effect of ylang oil and lemon oil inhalation on labor pain and anxiety pregnant women: A randomized controlled trial.,Journal Article; Review,2023,https://pubmed.ncbi.nlm.nih.gov/37054616/
Ylang Ylang,Ylang Ylang,35065387,Comparison of chemometric assisted targeted and untargeted approaches for the prediction of radical scavenging activity of ylang-ylang essential oils.,Comparative Study; Journal Article,2021,https://pubmed.ncbi.nlm.nih.gov/35065387/
Ylang Ylang,Ylang Ylang,34222588,Art of Prevention: Essential Oils - Natural Products Not Necessarily Safe.,Journal Article; Review,2020,https://pubmed.ncbi.nlm.nih.gov/34222588/
Ylang Ylang,Ylang Ylang,31556690,Trial of Essential Oils to Improve Sleep for Patients in Cardiac Rehabilitation.,Journal Article; Randomized Controlled Trial,2019,https://pubmed.ncbi.nlm.nih.gov/31556690/
Ylang Ylang,Ylang Ylang,29535280,"[Effects of Aromatherapy on Stress Responses, Autonomic Nervous System Activity and Blood Pressure in the Patients Undergoing Coronary Angiography: A Non-Randomized Controlled Trial].",Controlled Clinical Trial; Journal Article,2018,https://pubmed.ncbi.nlm.nih.gov/29535280/
Ylang Ylang,Ylang Ylang,27427818,"Essential Oils, Part IV: Contact Allergy.",Journal Article; Review,2016,https://pubmed.ncbi.nlm.nih.gov/27427818/
Ylang Ylang,Ylang Ylang,27344500,Olfactory stimulation induces delayed responses in epilepsy.,"Journal Article; Multicenter Study; Research Support, Non-U.S. Gov't",2016,https://pubmed.ncbi.nlm.nih.gov/27344500/
Ylang Ylang,Ylang Ylang,26890296,Evaluation and Monitoring of a Child With Hydrocarbon Pneumonitis Using Point-of-Care Lung Ultrasound in the Pediatric Emergency Department.,Case Reports; Journal Article,2016,https://pubmed.ncbi.nlm.nih.gov/26890296/
Ylang Ylang,Ylang Ylang,26665978,Potential of native Thai aromatic plant extracts in antiwrinkle body creams.,"Journal Article; Randomized Controlled Trial; Research Support, Non-U.S. Gov't",2015,https://pubmed.ncbi.nlm.nih.gov/26665978/
Ylang Ylang,Ylang Ylang,26294929,"Traditional Uses, Phytochemistry, and Bioactivities of Cananga odorata (Ylang-Ylang).",Journal Article; Review,2015,https://pubmed.ncbi.nlm.nih.gov/26294929/
Ylang Ylang,Ylang Ylang,25438256,Efficacy of Thai herbal essential oils as green repellent against mosquito vectors.,"Clinical Trial; Journal Article; Research Support, Non-U.S. Gov't",2014,https://pubmed.ncbi.nlm.nih.gov/25438256/
Ylang Ylang,Ylang Ylang,25076278,[Aromatherapy with ylang ylang for anxiety and self-esteem: a pilot study].,English Abstract; Journal Article; Randomized Controlled Trial,2014,https://pubmed.ncbi.nlm.nih.gov/25076278/
Ylang Ylang,Ylang Ylang,23081867,Essential oils and their compositions as spatial repellents for pestiferous social wasps.,Evaluation Study; Journal Article,2012,https://pubmed.ncbi.nlm.nih.gov/23081867/
Ylang Ylang,Ylang Ylang,22936057,Adverse effects of aromatherapy: a systematic review of case reports and case series.,"Journal Article; Research Support, Non-U.S. Gov't; Systematic Review",2012,https://pubmed.ncbi.nlm.nih.gov/22936057/
Ylang Ylang,Ylang Ylang,22782885,Comparative chemical and molecular variability of Cananga odorata (Lam.) Hook.f. & Thomson forma genuina (ylang-ylang) in the Western Indian Ocean Islands: implication for valorization.,"Comparative Study; Journal Article; Research Support, Non-U.S. Gov't",2012,https://pubmed.ncbi.nlm.nih.gov/22782885/
Ylang Ylang,Ylang Ylang,22543614,"The effects of herbal essential oils on the oviposition-deterrent and ovicidal activities of Aedes aegypti (Linn.), Anopheles dirus (Peyton and Harrison) and Culex quinquefasciatus (Say).","Comparative Study; Journal Article; Research Support, Non-U.S. Gov't",2012,https://pubmed.ncbi.nlm.nih.gov/22543614/
Ylang Ylang,Ylang Ylang,22086772,Evaluation of the effects of plant-derived essential oils on central nervous system function using discrete shuttle-type conditioned avoidance response in mice.,"Comparative Study; Journal Article; Research Support, Non-U.S. Gov't",2011,https://pubmed.ncbi.nlm.nih.gov/22086772/
Ylang Ylang,Ylang Ylang,22031371,[The use of aromatherapy to improve self-esteem].,English Abstract; Journal Article; Randomized Controlled Trial,2011,https://pubmed.ncbi.nlm.nih.gov/22031371/
Ylang Ylang,Ylang Ylang,21157172,"[Effects of aromatherapy on changes in the autonomic nervous system, aortic pulse wave velocity and aortic augmentation index in patients with essential hypertension].",Controlled Clinical Trial; Journal Article,2010,https://pubmed.ncbi.nlm.nih.gov/21157172/
Ylang Ylang,Ylang Ylang,20946456,Contact allergy to essential oils: current patch test results (2000-2008) from the Information Network of Departments of Dermatology (IVDK).,Journal Article; Multicenter Study,2010,https://pubmed.ncbi.nlm.nih.gov/20946456/
Ylang Ylang,Ylang Ylang,18041606,Modulation of cognitive performance and mood by aromas of peppermint and ylang-ylang.,Comparative Study; Journal Article; Randomized Controlled Trial,2008,https://pubmed.ncbi.nlm.nih.gov/18041606/
Ylang Ylang,Ylang Ylang,17980945,Safety assessment of Ylang-Ylang (Cananga spp.) as a food ingredient.,"Journal Article; Research Support, Non-U.S. Gov't; Review",2007,https://pubmed.ncbi.nlm.nih.gov/17980945/
Ylang Ylang,Ylang Ylang,17309462,"Patch test results with patients' own perfumes, deodorants and shaving lotions: results of the IVDK 1998-2002.",Journal Article; Multicenter Study,2007,https://pubmed.ncbi.nlm.nih.gov/17309462/
Ylang Ylang,Ylang Ylang,16807875,Relaxing effect of ylang ylang oil on humans after transdermal absorption.,"Clinical Trial; Journal Article; Research Support, Non-U.S. Gov't",2006,https://pubmed.ncbi.nlm.nih.gov/16807875/
Ylang Ylang,Ylang Ylang,16800274,Delayed-type hypersensitivity to fragrance materials in a select North American population.,Comparative Study; Journal Article; Multicenter Study,2006,https://pubmed.ncbi.nlm.nih.gov/16800274/
Ylang Ylang,Ylang Ylang,15982998,"Medicinal plants for insomnia: a review of their pharmacology, efficacy and tolerability.",Journal Article; Review,2005,https://pubmed.ncbi.nlm.nih.gov/15982998/
Ylang Ylang,Ylang Ylang,15303255,Evaluation of the harmonizing effect of ylang-ylang oil on humans after inhalation.,"Clinical Trial; Journal Article; Randomized Controlled Trial; Research Support, Non-U.S. Gov't",2004,https://pubmed.ncbi.nlm.nih.gov/15303255/
Ylang Ylang,Ylang Ylang,12534532,Further important sensitizers in patients sensitive to fragrances.,"Evaluation Study; Journal Article; Multicenter Study; Research Support, Non-U.S. Gov't",2002,https://pubmed.ncbi.nlm.nih.gov/12534532/
Ylang Ylang,Ylang Ylang,12389342,The in vivo pediculicidal efficacy of a natural remedy.,Clinical Trial; Comparative Study; Journal Article; Randomized Controlled Trial,2002,https://pubmed.ncbi.nlm.nih.gov/12389342/
Ylang Ylang,Ylang Ylang,12000321,Fragrance contact dermatitis - a worldwide multicenter investigation (Part III).,"Journal Article; Multicenter Study; Research Support, Non-U.S. Gov't",2002,https://pubmed.ncbi.nlm.nih.gov/12000321/
Ylang Ylang,Ylang Ylang,11011949,Occupational contact dermatitis from ylang-ylang oil.,Case Reports; Journal Article,2000,https://pubmed.ncbi.nlm.nih.gov/11011949/
Ylang Ylang,Ylang Ylang,8796746,Fragrance contact dermatitis: a worldwide multicenter investigation (Part I).,"Journal Article; Multicenter Study; Research Support, Non-U.S. Gov't",1996,https://pubmed.ncbi.nlm.nih.gov/8796746/
Ylang Ylang,Ylang Ylang,8565465,Occupational allergic contact dermatitis caused by ylang-ylang oil.,Case Reports; Journal Article,1995,https://pubmed.ncbi.nlm.nih.gov/8565465/
Ylang Ylang,Ylang Ylang,3680980,Differential hypermelanosis induced by allergic contact dermatitis.,Comparative Study; Journal Article,1987,https://pubmed.ncbi.nlm.nih.gov/3680980/
Linalool,Linalool,40977293,Bioactivity of Linalool Against Culex quinquefasciatus: Repellent and Larvicidal Evaluations.,Journal Article; Review,2025,https://pubmed.ncbi.nlm.nih.gov/40977293/
Linalool,Linalool,40946208,Beyond Pigmentation: The Regulatory Role of Carotenoids in Tea Flavor Formation.,Journal Article; Review,2025,https://pubmed.ncbi.nlm.nih.gov/40946208/
Linalool,Linalool,40872493,Phytochemical Modulators of Nociception: A Review of Cannabis Terpenes in Chronic Pain Syndromes.,Journal Article; Review,2025,https://pubmed.ncbi.nlm.nih.gov/40872493/
Linalool,Linalool,40855584,"Optimization of Lavender Essential Oil and Phenolic Yield: Advances in Extraction, Metabolomics, and Functional Benefits.",Journal Article; Review,2025,https://pubmed.ncbi.nlm.nih.gov/40855584/
